{
    "escopo": "cte",
    "codigo": "configuracoes",
    "descricao": "Layout de configurações do CTe Web",
    "tenant": 0,
    "grupo_empresarial": "00000000-0000-0000-0000-000000000000",
    "grupo_acesso": "00000000-0000-0000-0000-000000000000",
    "created_by": "versionamento@nasajon.com.br",
    "updated_by": "versionamento@nasajon.com.br",
    "json_schema": {
        "id": "cte_configuracoes",
        "type": "div",
        "props": {
            "style": {
                "maxWidth": "70rem",
                "margin": "0 auto"
            }
        },
        "transaction": {
            "name": "configuracoes",
            "entities": [
                {
                    "name": "configuracoes",
                    "schema": "cte/Configuracoes",
                    "load": true
                }
            ]
        },
        "app_bar": {
            "pageTitle": "Configurações"
        },
        "children": [
            {
                "type": "Row",
                "props": {
                    "horizontalAlignment": "space-between",
                    "verticalAlignment": "center"
                },
                "children": [
                    {
                        "type": "Button",
                        "props": {
                            "buttonType": "primary",
                            "onClick": "commit"
                        },
                        "children": ["Salvar"]
                    }
                ]
            },
            {
                "type": "div",
                "props": {
                    "style": { "height": "1rem" }
                }
            },
            {
                "type": "GenericForm",
                "props": {
                    "dataRef": "configuracoes",
                    "isEdit": true
                },
                "children": [
                    {
                        "type": "Field",
                        "props": {
                            "field": "AmbienteEmissorDocumentos",
                            "label": "Ambiente de Emissão",
                            "style": {
                                "maxWidth": "200px"
                            }
                        }
                    },
                    {
                        "type": "div",
                        "props": {
                            "style": { "height": "1rem" }
                        }
                    }
                ]                 
            }
        ]
    }
}
